{
  "schemaVersion": 1,
  "languageId": "rust",
  "displayName": "Rust",
  "concepts": [
    {
      "id": "imports",
      "aliases": [
        "imports",
        "bring into scope",
        "namespace",
        "use",
        "import",
        "alias"
      ],
      "patterns": [
        "\\buse\\s+",
        "\\bstd::"
      ]
    },
    {
      "id": "functions",
      "aliases": [
        "function",
        "functions",
        "arguments",
        "return value",
        "define function",
        "signature"
      ],
      "patterns": [
        "\\bfn\\s+",
        "->"
      ]
    },
    {
      "id": "modules",
      "aliases": [
        "module",
        "modules",
        "visibility",
        "public",
        "private",
        "organize files",
        "export"
      ],
      "patterns": [
        "\\bmod\\s+",
        "\\bpub(?:\\s|\\()"
      ]
    },
    {
      "id": "constants",
      "aliases": [
        "constant",
        "constants",
        "global",
        "static",
        "fixed value"
      ],
      "patterns": [
        "\\b(?:const|static)\\s+"
      ]
    },
    {
      "id": "bindings",
      "aliases": [
        "variable",
        "variables",
        "binding",
        "mutable variable",
        "reassign",
        "shadowing"
      ],
      "patterns": [
        "\\blet\\s+",
        "\\bmut\\s+"
      ]
    },
    {
      "id": "ownership",
      "aliases": [
        "ownership",
        "owner",
        "move",
        "moved value",
        "use after move",
        "transfer",
        "consumed"
      ],
      "patterns": [
        "\\bdrop\\s*\\(",
        "\\bString::from"
      ]
    },
    {
      "id": "borrowing",
      "aliases": [
        "borrow",
        "borrowing",
        "reference",
        "references",
        "read without moving",
        "lend",
        "share without copying",
        "borrowed"
      ],
      "patterns": [
        "&(?:mut\\s+)?(?:self|str|String|\\w+)"
      ]
    },
    {
      "id": "mutable-borrow",
      "aliases": [
        "mutable borrow",
        "change through reference",
        "modify borrowed value",
        "exclusive access"
      ],
      "patterns": [
        "&mut\\b",
        "\\bpush(?:_str)?\\s*\\("
      ]
    },
    {
      "id": "copy-clone",
      "aliases": [
        "copy",
        "clone",
        "duplicate",
        "keep original",
        "duplicate owned data"
      ],
      "patterns": [
        "\\.clone\\s*\\(",
        "\\b(?:Copy|Clone)\\b"
      ]
    },
    {
      "id": "strings",
      "aliases": [
        "string",
        "strings",
        "text",
        "owned string",
        "string slice",
        "convert text"
      ],
      "patterns": [
        "\\b(?:String|str)\\b",
        "\\.to_string\\s*\\("
      ]
    },
    {
      "id": "slices",
      "aliases": [
        "slice",
        "slices",
        "array view",
        "portion of array",
        "subsequence"
      ],
      "patterns": [
        "&\\[",
        "\\[[^\\]\\n]*\\.\\."
      ]
    },
    {
      "id": "option",
      "aliases": [
        "option",
        "optional",
        "maybe",
        "missing value",
        "absence",
        "nullable",
        "null",
        "none",
        "some",
        "handle missing",
        "might be absent"
      ],
      "patterns": [
        "\\b(?:Option|Some|None)\\b",
        "\\.(?:unwrap_or|as_ref|take)\\s*\\("
      ]
    },
    {
      "id": "result",
      "aliases": [
        "result",
        "error",
        "errors",
        "fallible",
        "failure",
        "recover",
        "propagate error",
        "error handling",
        "exception"
      ],
      "patterns": [
        "\\b(?:Result|Ok|Err)\\b",
        "\\?\\s*(?:;|$)",
        "\\.map_err\\s*\\("
      ]
    },
    {
      "id": "matching",
      "aliases": [
        "match",
        "matching",
        "pattern matching",
        "pattern",
        "destructure",
        "switch",
        "branches",
        "exhaustive",
        "let chain",
        "let chains",
        "destructuring assignment"
      ],
      "patterns": [
        "\\bmatch\\s+",
        "=>",
        "\\bif\\s+let\\b",
        "\\bwhile\\s+let\\b",
        "&&\\s*let\\b",
        "\\bmatches!"
      ]
    },
    {
      "id": "structs",
      "aliases": [
        "struct",
        "structure",
        "record",
        "fields",
        "data type",
        "named fields"
      ],
      "patterns": [
        "\\bstruct\\s+",
        "\\bSelf\\s*\\{"
      ]
    },
    {
      "id": "enums",
      "aliases": [
        "enum",
        "enumeration",
        "variants",
        "tagged union",
        "sum type",
        "one of"
      ],
      "patterns": [
        "\\benum\\s+"
      ]
    },
    {
      "id": "methods",
      "aliases": [
        "method",
        "methods",
        "constructor",
        "associated function",
        "self",
        "implementation",
        "impl"
      ],
      "patterns": [
        "\\bimpl\\b",
        "&self",
        "&mut\\s+self"
      ]
    },
    {
      "id": "traits",
      "aliases": [
        "trait",
        "traits",
        "interface",
        "shared behavior",
        "implement behavior",
        "polymorphism",
        "contract",
        "supertrait",
        "supertraits",
        "default method",
        "generic associated type",
        "gat",
        "associated type"
      ],
      "patterns": [
        "\\btrait\\s+",
        "\\bimpl\\s+\\w+\\s+for\\b",
        "\\bdyn\\s+"
      ]
    },
    {
      "id": "generics",
      "aliases": [
        "generic",
        "generics",
        "type parameter",
        "type parameters",
        "trait bound",
        "bounds",
        "where",
        "any type",
        "generic struct",
        "generic enum",
        "generic implementation",
        "default type parameter",
        "unsized",
        "sized bound"
      ],
      "patterns": [
        "\\bwhere\\b",
        "\\b(?:fn|struct|enum|trait|type)\\s+\\w+\\s*<",
        "\\bimpl\\s*<",
        "\\bimpl\\s+\\w+\\s*[+>]",
        "\\?Sized\\b"
      ]
    },
    {
      "id": "lifetimes",
      "aliases": [
        "lifetime",
        "lifetimes",
        "how long reference lives",
        "dangling reference",
        "reference validity",
        "outlive",
        "borrow duration",
        "lifetime bounds",
        "outlives",
        "static lifetime"
      ],
      "patterns": [
        "(?<!\\b(?:break|continue)\\s+)'[a-z_][a-z0-9_]*\\b(?![a-z0-9_]|\\s*:(?!:))"
      ]
    },
    {
      "id": "iterators",
      "aliases": [
        "iterator",
        "iterators",
        "iterate",
        "iteration",
        "loop over",
        "pipeline",
        "transform collection",
        "filter collection",
        "map",
        "filter",
        "collect",
        "reduce",
        "each element"
      ],
      "patterns": [
        "\\.(?:iter|iter_mut|into_iter|map|filter|collect|fold|enumerate|zip)\\s*(?:\\(|::)"
      ]
    },
    {
      "id": "closures",
      "aliases": [
        "closure",
        "closures",
        "lambda",
        "anonymous function",
        "capture",
        "callback",
        "fn trait",
        "fnmut",
        "fnonce",
        "closure bounds",
        "return closure"
      ],
      "patterns": [
        "(?:^|[=(,:;{]\\s*|\\bmove\\s+|\\basync\\s+)\\|[^|\\n]*\\|",
        "\\b(?:Fn|FnMut|FnOnce)\\s*\\("
      ]
    },
    {
      "id": "vectors",
      "aliases": [
        "vector",
        "vectors",
        "list",
        "dynamic array",
        "growable array",
        "vec",
        "push"
      ],
      "patterns": [
        "\\bVec\\b",
        "\\bvec!",
        "\\.push\\s*\\("
      ]
    },
    {
      "id": "maps",
      "aliases": [
        "hashmap",
        "hash map",
        "dictionary",
        "lookup table",
        "key value",
        "entry"
      ],
      "patterns": [
        "\\bHashMap\\b",
        "\\.entry\\s*\\("
      ]
    },
    {
      "id": "loops",
      "aliases": [
        "loop",
        "loops",
        "repeat",
        "while",
        "break",
        "continue",
        "range",
        "loop label",
        "labelled loop",
        "labeled loop",
        "nested loop",
        "skip iteration"
      ],
      "patterns": [
        "\\b(?:for|while|loop)\\b",
        "\\b(?:break|continue)\\b",
        "'[a-z_]\\w*\\s*:\\s*(?:for|while|loop)\\b"
      ]
    },
    {
      "id": "async",
      "aliases": [
        "async",
        "asynchronous",
        "await",
        "future",
        "futures",
        "concurrent",
        "concurrency",
        "async closure",
        "async callback"
      ],
      "patterns": [
        "\\basync\\b",
        "\\.await\\b"
      ]
    },
    {
      "id": "tests",
      "aliases": [
        "test",
        "tests",
        "unit test",
        "assert",
        "assertion",
        "verify behavior"
      ],
      "patterns": [
        "#\\[(?:test|cfg\\(test\\))\\]",
        "\\bassert(?:_eq|_ne)?!"
      ]
    },
    {
      "id": "derive",
      "aliases": [
        "derive",
        "derive macros",
        "automatic implementation",
        "debug",
        "display data",
        "print structure"
      ],
      "patterns": [
        "#\\[derive",
        "\\bDebug\\b"
      ]
    },
    {
      "id": "smart-pointers",
      "aliases": [
        "box",
        "heap",
        "recursive type",
        "smart pointer",
        "shared ownership",
        "rc",
        "arc",
        "reference counted",
        "reference counting"
      ],
      "patterns": [
        "\\b(?:Box|Rc|Arc)\\b"
      ]
    },
    {
      "id": "interior-mutability",
      "aliases": [
        "interior mutability",
        "refcell",
        "mutex",
        "lock",
        "shared mutable state",
        "change shared data"
      ],
      "patterns": [
        "\\b(?:RefCell|Mutex)\\b",
        "\\.borrow_mut\\s*\\("
      ]